uid,body,title,url,newspaper_uid,host,n_tokenstitle,n_tokensbody
0427716503bb6fc4e78265ebe80a1b68,"El próximo 21 de junio inicia el verano 2019. El verano es la estación que sigue a la primavera, se caracteriza porque los días son más largos que las noche y, debido a la inclinación de la Tierra, es la estación más calurosa. Inicia con el Solsticio de Verano, que es el día más largo del año. El verano 2019 empezará en México el 21 de junio a las 15:54 horas. Durante el Solsticio de Verano se presentan algunos fenómenos arqueoastronómicos en las antiguas ciudades precolombinas: en Chichén Itzá, en donde la posición del Sol hace que dos lados de “El Castillo” queden iluminados y otros dos en la sombra. (Con información de la UNAM)    ",¿Cuándo inicia el verano 2019 en México?,http://www.unionpuebla.mx/articulo/2019/06/04/medio-ambiente/cuando-inicia-el-verano-2019-en-mexico,eluniversal,www.unionpuebla.mx,2,35
c5aec88b626ea8997b42a13aea98e4b4,nan,Vive_USA,https://twitter.com/Vive_USA,eluniversal,twitter.com,0,1
495963089951efc69c8bc118840da594," Ricardo Contreras, presidente de la Federación Mexicana de Boxeo, reconoció que aunque por ahora, Ana Gabriela Guevara ha hecho sólo promesas a las federaciones deportivas en cuestión de apoyo, la diferencia con la administración pasada, dirigida por Alfredo Castillo, es que “no viene con el ánimo de confrontación, sino de conciliación”. El boxeo fue de los organismos más atacados por Castillo, tanto que Contreras reveló, “por cuatro años no recibimos un peso de apoyo, y nos quitaron el registro ante el Sinade. Hoy, lo hemos recuperado, tenemos la promesas de apoyo para los siguientes ciclos y eso ya es un avance”. Pero no por eso, “tenemos que olvidar que este Gobierno tiene una política de austeridad de la cual el deporte no se puede sustraer. Entendemos que estamos en una época de ajuste, y ojalá pronto todo retome su cauce normal”. Es por eso que los seis púgiles que van a los Juegos Panamericanos de Lima no llevan la exigencia de entregar resultados.      Artículo   Alexa Moreno no irá a los Juegos Panamericanos de Lima  Universal Deportes   Alexa no compitió en la última evaluación que se llevó a cabo el lunes pasado en Querétaro, lo que afectó su sumatoria de puntos de cara a Lima 2019          “Estos boxeadores no recibieron apoyo en lo que a fogueo se refiere, nada, aquí les dimos todo lo que pudimos en cuanto a técnica y demás, pero sólo eso”, explicó el federativo. Tan es así que el único campamento que se hizo en el exterior, “nos lo pagó la Federación de Boxeo de Rusia, llevamos a Rogelio Romero, el muchacho de la categoría de más de 81 kilos, y tres más que buscan ir a los Olímpicos de Tokio. Nosotros sólo cubrimos lo de las visas, unos 15 mil pesos, de un viaje que costó cerca de 20 mil dólares”. Sobre la posibilidad de cerrar parcialmente el Comité Olímpico Mexicano, por la falta de recursos, Contreras espera “que eso no llegue a suceder, no lo podemos permitir. Nunca el deporte mexicano ha vivido una situación que obligue a cerrar unas instalaciones llenas de historia, como lo son las del COM, donde tanto sudor y triunfo se ha entregado a México”.    [[nid:1649384] ","Boxeadores mexicanos, sin apoyo para los Juegos Panamericanos",http://www.eluniversal.com.mx/universal-deportes/box/boxeadores-mexicanos-sin-apoyo-para-los-juegos-panamericanos,eluniversal,www.eluniversal.com.mx,5,137
c92817143bc891c0a09ca05a8f4cefb8,"El bajo nivel de audiencia de la última temporada de MasterChef puso en entredicho la continuidad de Anette Michel en la conducción, misma que se acrecentó al aparecer como titular en ‘Venga La Alegría’. Para la edición de este año se espera el repunte del show gastronómico y los fans quieren a la conductora tapatía en su mejor versión. Algunas de las sorpresas preparadas por la producción es el supuesto regreso de los concursantes más polémicos del programa, entre ellos Maru, Pastor, Pablo Martí, Lourdes y Geny. Michel se mantiene en silencio respecto a la nueva temporada, lo único que se confirmó es la salida del Chef Benito Molina, quien se incorporó al programa MasterChef Latino, que se transmite a través del canal Telemundo para toda América Latina. El éxito de las primeras emisiones de MasterChef México se debió a la frescura de la tapatía y a su sencillez por atrapar a los fans. VER: El día que Anette Michel sufrió acoso ",Anette Michel en duda para MasterChef 2019,http://www.unionjalisco.mx/articulo/2019/06/07/espectaculos/anette-michel-en-duda-para-masterchef-2019?platform=hootsuite,eluniversal,www.unionjalisco.mx,4,63
eca2b02bcf9c1447c504938ccaaa341b," El abuso de quien tiene poder, sobre quien está en posición vulnerable, es el eje de las injusticias de este país, pues actualmente no existe una cultura de respeto por el prójimo y menos aún por sus derechos. El individualismo, que es la esencia de nuestra idiosincrasia, es el detonador de este grave problema. No puede haber justicia social, como pretende lograr la “cuarta transformación”, si no se parte del respeto a los derechos humanos como eje del cambio. Un gran avance en la lucha a favor del respeto a los derechos humanos se logró a partir de otorgársele autonomía a la CNDH, institución que tiene como misión proteger al ciudadano respecto de los abusos que pudieran nacer de las instituciones propias del Estado Mexicano. Por tanto, la CNDH no puede depender, ni estar subordinada a la misma autoridad a la que debe vigilar. Es preocupante que al darse a conocer la renuncia de Guillermo García Alcocer como presidente de la CRE, Comisión Reguladora de Energía, el presidente de México alabó la decisión de este funcionario argumentando que “quienes no comparten su proyecto, deben optar por otra manera de trabajar”. Esto significa no aceptar la independencia jurídica de los organismos autónomos, entre los que está la CRE, los cuales no deben estar supeditados a los criterios personales de los funcionarios públicos que ejercen cargos de liderazgo y poder en las instituciones gubernamentales. El criterio independiente de estos organismos debe generar los equilibrios necesarios para que a partir de la pluralidad, se tomen las mejores decisiones en beneficio del país. Sin embargo, la visión centralista que hoy impera en el nuevo gobierno considera que los contrapesos son un obstáculo en contra de la voluntad personal de quien gobierna y de inmediato, quien no se alinea, se convierte en adversario. Tener una opinión diferente no debe significar rivalidad, sino al contrario, es otra forma de colaboración que enriquece el ejercicio de gobierno porque aporta otra visión complementaria para tomar las mejores decisiones. Por tanto, que la vigilancia del respeto a los derechos humanos descanse en un organismo independiente del Poder Ejecutivo, aporta imparcialidad, la cual se soporta precisamente en su autonomía. Ojalá que esta opinión expresada por el presidente de México ante la noticia de la renuncia del presidente de la CRE, García Alcocer, no esté manifestando una intención generalizada por controlar a todos los organismos autónomos y a aquellos que tienen una independencia fundamentada desde la constitución, como son los poderes: Judicial y Legislativo, que junto con el Poder Ejecutivo, que encabeza el presidente, conforman los tres Poderes de la Unión. No sobra recordar que el Poder Judicial está conformado por la Suprema Corte de Justicia, el Tribunal Electoral, los tribunales de circuito, colegiados y unitarios, los juzgados de distrito y el Consejo de la Judicatura Federal. A su vez, el Poder Legislativo está integrado por la Cámara de Senadores y la Cámara de Diputados, federal. Todos los presidentes que gobernaron nuestro país en los últimos años, incluyendo a Enrique Peña Nieto, fueron respetuosos de esta autonomía y es deseable y necesario que así continúe este equilibrio institucional, que es la base del espíritu democrático del Estado Mexicano. Sin embargo, este criterio debe abarcar a todos los organismos autónomos como la CNDH, el INE, el INAI, así como otros de gran representatividad y liderazgo público en su área de especialidad. El desinterés presidencial por conocer de forma directa y de primera mano el informe anual de la CNDH y la problemática que rodea a los derechos humanos, puede ser interpretado como una estrategia para marcar distancia con la actual gestión de la CNDH, que preside Luís Raúl González Pérez, para no comprometerse a dar respuesta al diagnóstico presentado y menos aún, darse por enterado de su contenido. Para un país al cual le urge construir una cultura de respeto a los derechos humanos, porque no existe y para un gobierno que tiene como reto combatir la violencia y para ello está generando cambios estructurales en su política de seguridad pública, como lo es la creación de la Guardia Nacional, es fundamental blindar toda esta transformación operativa. Para ello se requiere del apoyo y colaboración de una estructura experimentada y confiable que garantice que la lucha contra la violencia delincuencial se llevará a cabo respetando los derechos humanos. La operación de la nueva Guardia Nacional necesitará de la mirada vigilante de una CNDH fuerte y respetada, que se convierta en su contrapeso y además, tenga la capacidad de no doblegarse ante el poder de una institución policial que nace con grandes retos y una gran exigencia de eficiencia y eficacia. Esta presión por lograr resultados rápidos, generará condiciones en las cuales la exigencia de alcanzar las metas propicie excesos y quizá hasta el riesgo de violación de derechos humanos. Por tanto, se vuelve necesario contar con una CNDH autónoma respecto del Poder Ejecutivo, confiable y experimentada y por fuerza, distanciada de la estructura gubernamental. ¿Usted cómo lo ve? Facebook: @Ricardo.homs1 Twitter: @homsricardo Linkedin: Ricardo Homswww.ricardohoms.com ","Indiferencia ante el abuso, en derechos humanos",https://www.eluniversal.com.mx/articulo/ricardo-homs/nacion/indiferencia-ante-el-abuso-en-derechos-humanos,eluniversal,www.eluniversal.com.mx,4,348
287f46639d5a11c2eac10931855b4ab2,"La foto lo dijo todo: Un indígena ardía en llamas, su rostro iluminado por el fuego reflejaba el dolor, mientras sus compañeros que se oponían a un desalojo, lo miraban azorados. Esta historia gráfica captada el 19 de septiembre del 2018, por el fotógrafo de El Gráfico, Juan Armando Martínez Argüelles, fue galardonada este viernes como “La fotografía más oportuna”, durante el Premio Nacional de Periodismo 2019, organizado por el Club de Periodistas de México A.C. Ese miércoles, el reportero gráfico acudió a un intento de desalojo de un predio, en la colonia Juárez. Tratando de ahuyentar a policías y cargadores, uno de los invasores roció de gasolina el campamento, pero en un descuido, su ropa se impregnó de combustible, por lo que el hombre ardió en llamas. Antes del incendio, Armando se percató de las intenciones del invasor, por lo que su olfato periodístico le indicó que algo importante iba a ocurrir. Y así pasó, cuando captó el momento del accidente que casi le cuesta la vida al individuo. La adrenalina por los acontecimientos, el peligro del incendio, mezclada con la fascinación por captar la mejor imagen, lograron una excelente fotografía que fue elegida para la portada de El Gráfico en su edición del 20 de septiembre y a la postre, el jurado calificador del Certamen Nacional de Periodismo la eligió como la ganadora del Premio.     Egresado de la UNAM, en el 2009 todavía quería ser cronista deportivo, pero sus amistades lo llevaron por otro camino, “tuve la oportunidad de coincidir con un compañero y su papá se dedicaba a la nota roja, desde ahí, cuando me mostraba su trabajo, quedé prendido de su profesión"". Su padre leía El Gráfico, y como él y su hermano eran menores de edad, les escondía el periódico para que no se impactaran con las imágenes. Pero eso nunca lo detuvo. Diez años han pasado desde que se sumergió en ese universo donde la muerte y la tragedia son el día a día, donde la realidad supera la ficción. “Mi trabajo me gusta porque sé que es importante para la sociedad, el que documente alguien lo que realmente pasa en las calles. Mi tarea es dar a conocer estos hechos, los cuales a la larga se convierten en indicadores de dónde hay inseguridad”, explica. Juan Armando Martínez Argüelles tiene cinco años trabajando para El Gráfico y es parte del equipo que también realiza las transmisiones en vivo del acontecer diario, desde redes sociales. Acompañado de su familia, recibió la medalla que corona una década de trayectoria y de la cual se enorgullece. “Para hacerlo, siento que necesitas tener algo que te vibre”, puntualiza.         Ver esta publicación en Instagram  Una publicación compartida por El Gráfico (@elgraficomx) el 7 de Jun de 2019 a las 5:41 PDT           Ver esta publicación en Instagram  Una publicación compartida por El Gráfico (@elgraficomx) el 7 de Jun de 2019 a las 5:42 PDT           Ver esta publicación en Instagram  Una publicación compartida por El Gráfico (@elgraficomx) el 7 de Jun de 2019 a las 5:43 PDT           Ver esta publicación en Instagram  Una publicación compartida por El Gráfico (@elgraficomx) el 7 de Jun de 2019 a las 6:22 PDT   ",fotografo de el grafico gana premio nacional de periodismo por foto de hombre en llamas,https://www.elgrafico.mx/la-roja/fotografo-de-el-grafico-gana-premio-nacional-de-periodismo-por-foto-de-hombre-en-llamas,eluniversal,www.elgrafico.mx,9,186
5da5c245ef720979b25c36ac56a7cce3,nan,viveusa.mx,https://www.facebook.com/viveusa.mx,eluniversal,www.facebook.com,0,1
0aa21faf3ebd398918c4ed70f6f5a5b3,"  El canciller Marcelo Ebrard y su equipo lograron lo que ya muchos daban por tiempo y esfuerzo perdido. Las negociaciones y promesas de endurecer por parte de México su política migratoria surtieron efecto y lograron apaciguar la furia del inquilino de la Casa Blanca. De manera indefinida ha suspendido el gobierno de Donald Trump la aplicación de aranceles comerciales a los productos mexicanos que intentaran comercializarse en Estados Unidos a partir del lunes próximo.  Pero no hay que cantar victoria: hasta el día de hoy se mantiene en el horizonte la amenaza de los aranceles a las exportaciones mexicanas hacia EU. Es una batalla en la que tan sólo se consiguió un respiro que no se sabe qué tan breve sea. Se trata de una tregua en una guerra que no hay que dar aún por perdida. Lo que sucedió durante esta semana deja claro que las negociaciones son un buen camino pero hay que tener una mayor capacidad de presión al interior de la economía estadounidense. No es precisamente con marchas como se van a solucionar este tipo de situaciones. Hay que buscar otros actores de presión cuyos intereses se alineen con México, como el del sector de los empresarios estadounidenses que dependen de las mercancías mexicanas. Hay que construir o reforzar esas redes de negocios, pues da la impresión de que Trump puede tomar este tipo de decisiones sin consecuencias para su país, siendo que por el contrario el consumidor y la industria norteamericanos también se van a ver afectados en algún modo.  Con ningún otro país se encuentra tan vinculado México como con Estados Unidos. Ni siquiera con alguno de América Latina, con los que compartimos tantas cosas en común como idioma, idiosincracia o problemas similares. Estados Unidos está tan indisolublemente unido a nuestra nación que sólo baste recordar que una buena parte de su territorio en algún momento formó parte del nuestro o que en la actualidad poco más de 30 millones de habitantes en EU mantienen algún tipo de vínculo con México, ya sea familiar o por lo menos cultural.  Lo acontecido esta semana tendría que servir de lección para el futuro. Por supuesto que la negociación tiene que darse con el gobierno estadounidense, pero al mismo tiempo buscar alianzas con otros sectores. En el Senado y la Cámara de Representantes hay legisladores que entienden la complementación que han alcanzado las economías de ambos países y por lo tanto se convierten en aliados naturales contra la imposición de aranceles. Estados y ciudades estadounidenses son también otra veta de oportunidad. Texas y California, por ejemplo, tienen en México un importante socio comercial. Trump es el mandatario estadounidense, pero hay otros sectores que fungen como enormes contrapesos. Eso debe aprovecharlo el gobierno mexicano, ahora y en situaciones futuras. ",La tregua de Donald Trump,https://www.eluniversal.com.mx/articulo/editorial-el-universal/nacion/la-tregua-de-donald-trump,eluniversal,www.eluniversal.com.mx,3,194
4310edeb74d055a33a69c48d859993f4,nan,ya sabemos quien sera el protagonista del desfile trooping colour en honor la reina isabel,https://www.revistaclase.mx/realeza/ya-sabemos-quien-sera-el-protagonista-del-desfile-trooping-colour-en-honor-la-reina-isabel,eluniversal,www.revistaclase.mx,9,1
cea30651b60cc7ff1dbc407e8347b0ba,"Jennifer Aniston se encuentra promocionando la nueva película original de Netflix, Murder Mystery, donde comparte créditos con Adam Sandler. Como parte de sus compromisos, la estrella de Friends visitó los estudios de Jimmy Kimmel Live en Hollywood ataviada con un elegante atuendo oscuro. La actriz de 50 años dejó en claro que la edad es sólo un número que no define talento, belleza o sensualidad. En esta ocasión, presumió su afilada figura con un conjunto de pantalones de vestir negros, un top de escote en V al estilo braless y un blazer verde militar.  Foto: The Grosby Group La estrella añadió un bolso de cadena de Chanel, stilletos negros, un reloj dorado a juego con pendientes de aro grandes, un collar largo y gafas claras. Definió sus rasgos con blush tenue, amplias pestañas negras y un poco de sombra en los párpados.  Su rubio cabello se vio alborotado por el aire que corría a las afueras de El Capitan Entertaiment Centre, por lo que los mechones le rosaban el rostro y caían sobre sus hombros. Visita        Rihanna luce sus curvas con lencería dorada   La cantante anunció que esta noche se lanzará su nueva colección de ropa interior     En la película Murder Mystery, Aniston y Sandler interpretan a una pareja casada que vacaciona en Europa, cuando se encuentran a un misterioso hombre que los invita a una reunión familiar con un anciano multimillonario en un yate. Cuando el anciano es asesinado, la pareja se convierte en los principales sospechosos. La première de la película está prevista para el 12 de junio bajo la participación de Adam Sandler, Luke Evans, Gemma Arterton y el mexicano Luis Gerardo Méndez. El rodaje comenzó en junio de 2018 en Montreal, Canadá para continuar en escenarios de Santa Margherita Ligure, el Lago Como y Milán, Roma.  Foto: AFP  Te puede interesar        A los 53, Elizabeth Hurley presume su silueta con bikini 'animal print'    La estrella de 'Al diablo con el diablo' está lista para el verano; presumió modelos de su propia línea de trajes de baño       • ¿Ya conoces nuestro canal de YouTube? ¡Suscríbete! ",jennifer aniston conquista hollywood con belleza y estilo los 50 anos,https://www.viveusa.mx/showbiz/jennifer-aniston-conquista-hollywood-con-belleza-y-estilo-los-50-anos,eluniversal,www.viveusa.mx,7,163
